[
  {
    "domain": "abelinc.me",
    "origin": "shortener",
    "consecutive_review_count": 1,
    "first_flagged_at": "2026-10-01",
    "last_status": "timeout",
    "last_checked_at": "2026-10-01"
  },
  {
    "domain": "amzn.pw",
    "origin": "shortener",
    "consecutive_review_count": 1,
    "first_flagged_at": "2026-10-01",
    "last_status": "timeout",
    "last_checked_at": "2026-10-01"
  },
  {
    "domain": "fb.me",
    "origin": "shortener",
    "consecutive_review_count": 1,
    "first_flagged_at": "2026-10-01",
    "last_status": "400",
    "last_checked_at": "2026-10-01"
  },
  {
    "domain": "fb.watch",
    "origin": "shortener",
    "consecutive_review_count": 1,
    "first_flagged_at": "2026-10-01",
    "last_status": "400",
    "last_checked_at": "2026-10-01"
  },
  {
    "domain": "m.me",
    "origin": "shortener",
    "consecutive_review_count": 1,
    "first_flagged_at": "2026-10-01",
    "last_status": "400",
    "last_checked_at": "2026-10-01"
  },
  {
    "domain": "mysp.ac",
    "origin": "shortener",
    "consecutive_review_count": 1,
    "first_flagged_at": "2026-10-01",
    "last_status": "timeout",
    "last_checked_at": "2026-10-01"
  },
  {
    "domain": "name.ly",
    "origin": "shortener",
    "consecutive_review_count": 1,
    "first_flagged_at": "2026-10-01",
    "last_status": "500",
    "last_checked_at": "2026-10-01"
  },
  {
    "domain": "rdcu.be",
    "origin": "shortener",
    "consecutive_review_count": 2,
    "first_flagged_at": "2026-09-01",
    "last_status": "202",
    "last_checked_at": "2026-10-01"
  },
  {
    "domain": "redir.is",
    "origin": "shortener",
    "consecutive_review_count": 1,
    "first_flagged_at": "2026-10-01",
    "last_status": "connect_error",
    "last_checked_at": "2026-10-01"
  },
  {
    "domain": "sht.moe",
    "origin": "shortener",
    "consecutive_review_count": 2,
    "first_flagged_at": "2026-09-01",
    "last_status": "530",
    "last_checked_at": "2026-10-01"
  },
  {
    "domain": "sincere.ly",
    "origin": "shortener",
    "consecutive_review_count": 2,
    "first_flagged_at": "2026-09-01",
    "last_status": "timeout",
    "last_checked_at": "2026-10-01"
  },
  {
    "domain": "soo.gd",
    "origin": "shortener",
    "consecutive_review_count": 2,
    "first_flagged_at": "2026-09-01",
    "last_status": "502",
    "last_checked_at": "2026-10-01"
  },
  {
    "domain": "to.ly",
    "origin": "shortener",
    "consecutive_review_count": 1,
    "first_flagged_at": "2026-10-01",
    "last_status": "502",
    "last_checked_at": "2026-10-01"
  },
  {
    "domain": "zi.ma",
    "origin": "shortener",
    "consecutive_review_count": 1,
    "first_flagged_at": "2026-10-01",
    "last_status": "timeout",
    "last_checked_at": "2026-10-01"
  }
]
